{
  "version": "1.0",
  "figure_id": "multidomain_diffusion_architecture",
  "title": "Multi-domain diffusion architecture",
  "language": "source",
  "truth_priority": [
    "user_corrections",
    "manuscript",
    "references",
    "image2_prompt",
    "generated_image"
  ],
  "source": {
    "generated_image": "example_reference.png",
    "paper_files": [
      "source/paper.pdf"
    ],
    "reference_files": [
      "source/reference-01.pdf"
    ],
    "image2_prompt_file": "source/image2_prompt.txt",
    "source_manifest": "source/source_manifest.json",
    "caption": "",
    "method_facts": [
      "Condition Net has four encoder levels and four decoder levels.",
      "Condition Net has four skip connections.",
      "Guidance variable is three rows by four connected cubes.",
      "Denoising Net has four encoder levels, four decoder levels, and four guidance inputs.",
      "Fusion Distribution contains four segmented cubes."
    ],
    "reference_facts": [],
    "unresolved_items": []
  },
  "page": {
    "width": 1180,
    "height": 452,
    "units": "px",
    "origin": "top-left",
    "target_width_in": 13.333,
    "background": "#FFF9F3"
  },
  "style": {
    "profile": "scientific_pastel",
    "palette": {
      "pink": "#D95B96",
      "light_pink": "#F7DDE9",
      "purple": "#8D6AC8",
      "orange": "#F3A55B",
      "grey": "#A9A9A9"
    },
    "global_notes": [
      "warm-white background",
      "soft pastel scientific illustration"
    ]
  },
  "regions": [
    {
      "id": "global_review",
      "source_bbox_px": [
        0,
        0,
        1180,
        452
      ],
      "target_bbox": [
        0,
        0,
        1180,
        452
      ],
      "categories": [
        "global"
      ],
      "crop_type": "global",
      "required_crop_types": [
        "global"
      ],
      "required_labels": [
        "Observation",
        "Condition Net",
        "Denoising Net",
        "Diffusion process"
      ],
      "required_component_motifs": [
        "whole scientific architecture layout"
      ],
      "required_edge_motifs": [
        "left-to-right global flow"
      ],
      "required_ports_or_boundaries": [
        "major module boundaries"
      ],
      "text_layout_facts": [
        "titles sit close to their modules"
      ],
      "box_style_facts": [
        "warm-white canvas with pale pink and purple regions"
      ],
      "line_style_facts": [
        "thin grey connectors"
      ],
      "shadow_facts": [
        "no heavy shadows"
      ],
      "density_facts": [
        "wide horizontal publication layout"
      ],
      "status": "draft"
    },
    {
      "id": "observation",
      "source_bbox_px": [
        25,
        80,
        220,
        300
      ],
      "target_bbox": [
        25,
        80,
        220,
        300
      ],
      "categories": [
        "input",
        "small_text"
      ],
      "crop_type": "input",
      "required_crop_types": [
        "input",
        "small_text"
      ],
      "required_labels": [
        "Observation",
        "D₁",
        "D₂",
        "D₃"
      ],
      "required_component_motifs": [
        "three-domain waveform panel"
      ],
      "required_edge_motifs": [
        "observation output"
      ],
      "required_ports_or_boundaries": [
        "right output boundary"
      ],
      "text_layout_facts": [
        "domain labels align with waveform rows"
      ],
      "box_style_facts": [
        "white rounded panel"
      ],
      "line_style_facts": [
        "three colored waveform paths"
      ],
      "shadow_facts": [
        "no shadow"
      ],
      "density_facts": [
        "exactly three waveform rows"
      ],
      "status": "draft"
    },
    {
      "id": "condition",
      "source_bbox_px": [
        210,
        35,
        550,
        290
      ],
      "target_bbox": [
        210,
        35,
        550,
        290
      ],
      "categories": [
        "core",
        "arrow_dense"
      ],
      "crop_type": "core",
      "required_crop_types": [
        "core",
        "arrow_dense"
      ],
      "required_labels": [
        "Condition Net"
      ],
      "required_component_motifs": [
        "four-level scientific U-Net"
      ],
      "required_edge_motifs": [
        "four skip connections"
      ],
      "required_ports_or_boundaries": [
        "left input",
        "right output"
      ],
      "text_layout_facts": [
        "title above the network"
      ],
      "box_style_facts": [
        "pale pink rounded background"
      ],
      "line_style_facts": [
        "four thin skip paths"
      ],
      "shadow_facts": [
        "soft or absent shadow"
      ],
      "density_facts": [
        "4 encoder + bottleneck + 4 decoder"
      ],
      "status": "draft"
    },
    {
      "id": "guidance",
      "source_bbox_px": [
        430,
        250,
        725,
        430
      ],
      "target_bbox": [
        430,
        250,
        725,
        430
      ],
      "categories": [
        "small_text"
      ],
      "crop_type": "small_text",
      "required_crop_types": [
        "small_text"
      ],
      "required_labels": [
        "Guidance variable"
      ],
      "required_component_motifs": [
        "3 by 4 segmented cube grid"
      ],
      "required_edge_motifs": [
        "guidance handoff"
      ],
      "required_ports_or_boundaries": [
        "grid output"
      ],
      "text_layout_facts": [
        "label stays above or beside the grid"
      ],
      "box_style_facts": [
        "three-dimensional cube faces"
      ],
      "line_style_facts": [
        "thin cube outlines"
      ],
      "shadow_facts": [
        "no drop shadow"
      ],
      "density_facts": [
        "exactly 12 cubes: 3 rows by 4 columns"
      ],
      "status": "draft"
    },
    {
      "id": "denoising",
      "source_bbox_px": [
        610,
        35,
        970,
        295
      ],
      "target_bbox": [
        610,
        35,
        970,
        295
      ],
      "categories": [
        "arrow_dense"
      ],
      "crop_type": "arrow_dense",
      "required_crop_types": [
        "arrow_dense"
      ],
      "required_labels": [
        "Denoising Net"
      ],
      "required_component_motifs": [
        "four-level scientific U-Net"
      ],
      "required_edge_motifs": [
        "four skip connections",
        "four guidance inputs"
      ],
      "required_ports_or_boundaries": [
        "left input",
        "right output",
        "four bottom guidance ports"
      ],
      "text_layout_facts": [
        "title above network"
      ],
      "box_style_facts": [
        "pale purple rounded background"
      ],
      "line_style_facts": [
        "four skip paths and four guidance arrows"
      ],
      "shadow_facts": [
        "soft or absent shadow"
      ],
      "density_facts": [
        "4 encoder + bottleneck + 4 decoder"
      ],
      "status": "draft"
    },
    {
      "id": "diffusion",
      "source_bbox_px": [
        700,
        290,
        1160,
        445
      ],
      "target_bbox": [
        700,
        290,
        1160,
        445
      ],
      "categories": [
        "output"
      ],
      "crop_type": "output",
      "required_crop_types": [
        "output"
      ],
      "required_labels": [
        "X₀",
        "Xₜ₋₁",
        "Xₜ",
        "X_T",
        "Diffusion process"
      ],
      "required_component_motifs": [
        "four-state diffusion timeline"
      ],
      "required_edge_motifs": [
        "forward process",
        "dashed feedback"
      ],
      "required_ports_or_boundaries": [
        "timeline endpoints"
      ],
      "text_layout_facts": [
        "state labels centered under symbols"
      ],
      "box_style_facts": [
        "white timeline cards"
      ],
      "line_style_facts": [
        "thin grey forward arrows and dashed return"
      ],
      "shadow_facts": [
        "no heavy shadow"
      ],
      "density_facts": [
        "exactly four labeled states"
      ],
      "status": "draft"
    }
  ],
  "modules": [
    {
      "id": "observation_panel",
      "type": "multi_domain_signal_panel",
      "bbox": [
        35,
        105,
        165,
        165
      ],
      "region_id": "observation",
      "label": "Observation",
      "parameters": {
        "domains": 3,
        "domain_labels": [
          "D₁",
          "D₂",
          "D₃"
        ],
        "seed": 7,
        "cycles": [
          2.2,
          3.0,
          4.1
        ]
      },
      "style": {
        "fill": "#FFFFFF",
        "line": "#D7CFC8"
      },
      "z": 10
    },
    {
      "id": "condition_bg",
      "type": "soft_architecture_background",
      "bbox": [
        230,
        55,
        300,
        215
      ],
      "region_id": "condition",
      "parameters": {
        "shape": "rounded",
        "title": "Condition Net",
        "allow_overlap": true
      },
      "style": {
        "fill": "#FBE7EF",
        "line": "none",
        "transparency_pct": 6
      },
      "z": 1
    },
    {
      "id": "condition_net",
      "type": "scientific_unet",
      "bbox": [
        250,
        78,
        265,
        160
      ],
      "region_id": "condition",
      "label": "Condition Net",
      "parameters": {
        "levels": 4,
        "skip_connections": 4,
        "guidance_inputs": 0,
        "background_visible": false
      },
      "style": {
        "encoder_fill": "#D95B96",
        "decoder_fill": "#ED99BE",
        "center_fill": "#F0B35F"
      },
      "z": 20
    },
    {
      "id": "guidance_grid",
      "type": "segmented_cube_grid",
      "bbox": [
        470,
        315,
        225,
        72
      ],
      "region_id": "guidance",
      "label": "Guidance variable",
      "parameters": {
        "rows": 3,
        "columns": 4,
        "depth_x_in": 0.1,
        "depth_y_in": -0.08
      },
      "style": {
        "row_fills": [